,user_input,retrieved_contexts,response,reference,context_precision,answer_relevancy,faithfulness,context_recall
8,What might hinder the U.S.'s ability to achieve strategic prevention of religious freedom violations?,"['with missionaries. Sunni Muslims and ethnic minorities, such as Azeris, Kurds, Arabs, and Baluchs, also experience restrictions on their cultural and political activities, with minority activists facing arbitrary arrests and unfair trials.42  B.   Criminalization of Dissent and Apostasy  Apostasy, the act of converting from Islam to another faith, carries severe consequences in Iran. Article 167 of the constitution and article 220 of the penal code address punishments, which are not explicitly codified but may carry the death penalty on the basis of Islamic jurisprudence. An example is the case of Yousef Nadarkhani, a pastor who faced the death penalty for converting from Islam to Christianity and for charges of evangelization. His sentence was later overturned. Expressing dissent against the Iranian regime’s interpretation of Islam or opposing certain laws is an offense against Islam and the Islamic Republic. Dissenters are often charged with committing crimes against national security, insulting the supreme leader, and “waging war against God” (mohaarebeh). The regime exploits overly broad articles of the penal code, including those related to propaganda against the state and establishment of or membership in “disruptive groups,” to prosecute human rights and religious minority activists.43  C.  Blasphemy Laws and Freedom of Speech  As previously mentioned, Iran’s constitution contains provisions to protect freedom of thought, religion, and belief, but it also qualifies that this freedom must conform to Islamic criteria. Blasphemy laws in Iran, particularly articles 262 and 513 of the penal code, are used to punish those who insult sacred religious values or Prophet Muhammad, with potential sentences ranging from imprisonment to the death penalty. Criticizing or expressing dissenting views regarding religion, including through online platforms, and promoting views contrary to state  https://perma.cc/3AAJ-AVZ2; Iran Human Rights Documentation Center, Apostasy in']","Alright, so I'm trying to figure out what might hinder the U.S. ability to achieve religious freedom violations. Let me break this down step by step. First, I need to understand what the question is asking. It's about religious freedom, specifically religious freedom, which is the right to freedom of religious belief in a state. The U.S. government has some concerns about religious freedom, but I'm not sure about the specifics. First, I should consider what the rights and obligations of individuals and organizations are. People have the right to access and express their religion. The government should ensure that this is protected. However, there are concerns about religious freedom. For example, some people might feel that not all religious groups can be freely associated with society. Others might worry that certain religious practices could infringe on the rights of religious freedom. Another concern is the impact of religious practices that could impact other beliefs or religions. If a religion is taught that conflicts with another religion, it could lead to tension and division within society. Additionally, some people might argue that the government should allow citizens to practice their religion without any restrictions. On the flip side, there are also concerns about the private sector. Some people might believe that the government should ensure that people with religious beliefs can practice their religion without any restrictions. However, the question is about what might hinder the government's ability to achieve these rights. I'm not sure about the specific policies or issues that the government might be concerned about. I know that there are concerns about hate crimes, like hate crimes in the private sector, which are crimes that involve the criminalization of religion. These crimes include crimes like the murder of a religious figure. Other concerns are about the practice of pseudoscience, which is the practice of believing in something without evidence, which can lead to misinformation and the spread of pseudoscience. There are also issues related to the legal definition of religion, such as the definition of a religion and whether it's a state or a place. Some people argue that a religion is a social construct, and therefore, the definition of a religion is not fixed. On the other hand, others believe that a religion is a defined concept, and therefore, the definition of a religion is a subject of debate. There are also concerns about the impact of religious freedom on people's lives and their ability to engage in certain activities. For example, people might be able to engage in religious activities, such as attending religious services or participating in religious activities. However, there might be concerns about whether these activities are protected or not. On the other side, there are people who might argue that certain religious activities are not protected and that they are not allowed to happen. These people might be influenced by religious beliefs or religious beliefs that they believe are harmful or violate the law. There might also be concerns about religious freedom in certain regions or communities. For example, some people might argue that certain religious practices are not protected by the law, and therefore, they are not allowed to occur. However, there might be instances where people in those communities are engaging in religious activities without any restrictions. On the other side, there might be arguments that the government should take action to protect religious freedom. This could include implementing laws, regulating religious practices, and ensuring that religious practices are conducted within certain boundaries. I'm not sure about the specific policies or actions that the government might be taking. I know that there are taxes, education, and religious freedom bills that are in place to protect religious freedom. However, there might be concerns about the implementation of these laws. For example, some people might argue that the government should ensure that people can attend religious services without any restrictions. On the other hand, others might argue that the laws are too restrictive and that people can still participate in religious activities without any restrictions. There might also be concerns about the impact of religious freedom on people's daily lives. For example, people might be able to attend religious services without any restrictions, but there might be fears that certain religious practices might infringe on the authority of the government. However, there might be instances where people are allowed to attend religious services without any restrictions. There might also be arguments about the impact of religious freedom on people's ability to engage in certain activities. However, there might be fears that certain religious practices might infringe on the authority of the government. I might need to look up some information on this topic to get a better understanding. One of the things I'm thinking about is the impact of religious freedom on people's ability to engage in certain activities. However, there might be laws that prevent people from engaging in certain activities, such as attending religious services without any restrictions. There might also be concerns about the impact of religious freedom on people's ability to engage in certain religious practices. For example, there might be laws that prohibit certain religious practices, such as the practice of certain religions or the suppression of certain religious practices. There might also be fears that certain religious practices might infringe on the authority of the government. However, there might be laws that ensure that certain religious practices are protected. On the other side, there might be arguments that the government should ensure that people's religious freedom is not restricted. However, there might be issues with implementing such restrictions. For example, there might be concerns about the implementation of certain laws that could have unintended consequences. There might also be fears that certain religious practices could infringe on the authority of the government. For example, there might be laws that could restrict certain religious practices or activities. There might also be fears that certain religious practices could infringe on the authority of certain religious groups or individuals. For example, there might be laws that could limit the freedom of religious expression or the freedom of religious belief. There might also be fears that certain religious practices could infringe on the freedom of religious belief. However, there might be laws that prevent certain religious practices or beliefs from being expressed without any restrictions. There might also be concerns about the impact of religious freedom on people's ability to engage in certain activities. For example, there might be fears that certain religious practices might interfere with people's ability to engage in certain activities, such as attending religious services without any restrictions. There might also be fears that certain religious practices might interfere with people's ability to engage in certain religious activities. However, there might be laws that prevent certain religious practices or activities. There might also be concerns about the impact of religious freedom on people's ability to engage in certain religious activities. For example, there might be fears that certain religious practices might infringe on the authority of certain religious activities. However, there might be laws that ensure that certain religious activities are protected. There might also be fears that certain religious practices might infringe on the authority of certain religious activities. For example, there might be laws that could limit certain religious activities or the activities themselves. For example, there might be fears that certain religious activities might infringe on the authority of certain religious activities. However, there might be laws that prevent certain religious activities from being conducted without any restrictions. There might also be fears that certain religious activities might infringe on the authority of certain religious activities. There might also be concerns",Failure to build sufficiently broad and globally diverse networks.,0.0,0.0,0.0,0.0
9,What is the energy efficiency target for Toyota's compact SUV in the bZ series?,"['transition and describe solutions in the distant future. We’re focused on making progress today. This means setting ambitious targets for emissions intensity reductions, developing new technologies and working with customers to develop solutions that help\xa0them lower their\xa0emissions.Having achieved our 2023 carbon intensity reduction goals, we set new targets last year. We’re executing projects to make progress toward our 2050 net zero aspiration for upstream Scope 1 and Scope 2 emissions. As part of these efforts, we’re improving methane detection, rethinking facility designs, optimizing equipment and utilizing more renewable power. \x0c“we are an even stronger company today than we were just a few years ago”– mike wirthSecurity and reliability of energy supply emerged as a major theme for energy markets in 2021 in places like California, Texas and Europe. Meanwhile, governments representing approximately 92% of global greenhouse gas emissions in 2021 have announced net zero goals or ambitions.Reaching the ambitions of the Paris Agreement will require innovation, breakthroughs in technology, more ambitious government policy and the ability to attract and forge new  partnerships. No one country, no one industry, no one company acting alone can meet the world’s energy and climate goals. That’s why we intend to be the partner of choice for those with complementary strengths. In our Downstream business, we have the capabilities, assets and supply chains needed to produce and distribute alternative fuels – renewable diesel, sustainable aviation fuel, renewable natural gas and hydrogen. These offer the potential for scalable, lower carbon options for critical segments of the economy that are difficult to decarbonize. Sustainable aviation fuel, for example, can lower emissions by up to 80% on a lifecycle basis compared to traditional jet fuel. It is compatible with modern aircraft engines and airport fueling infrastructure. We’ve produced an initial batch at our El Segundo']","The energy efficiency of a specific model depends on the product itself. In this case, I don’t have specific information about Toyota’s energy efficiency rating for the BZ series. However, I can provide a general answer: energy efficiency ratings are typically measured in miles per gallon (mpg) or kilometers per liter (L/km). SUVs generally have lower energy efficiencies compared to compact and mid-size compact models, but they can be more energy-efficient than compact cars. The BZ series is known for its energy efficiency, but the efficiency ratings can vary depending on the model and intended use. For example, the Toyota Model S is a compact energy-efficient vehicle, but it doesn’t necessarily have the BZ series rating.",125 watt-hours per kilometer.,0.0,0.0,0.2857142857142857,0.0
10,How does the performance of LSTUR-con measured by AUC compare to LSTUR-ini as the mask probability p increases?,"['since their probabil-ities can be pushed to 0 fairly easily. Meanwhile,the model can hardly distinguish between hard-negative examples and positive ones, which has ahuge negative effect on the ﬁnal F1 performance.To address this issue, we propose to multiply thesoft probability p with a decaying factor (1 −p),changing Eq.11 to the following adaptive variantof DSC:DSC(xi) = 2(1 −pi1)pi1 · yi1 + γ(1 −pi1)pi1 + yi1 + γ(12)One can think (1−pi1) as a weight associated witheach example, which changes as training proceeds.The intuition of changing pi1 to (1 −pi1)pi1 is topush down the weight of easy examples. For easyexamples whose probability are approaching 0 or1, (1−pi1)pi1 makes the model attach signiﬁcantlyless focus to them.A close look at Eq.12 reveals that it actually mim-ics the idea of focal loss (FL for short) (Lin et al.,2017) for object detection in vision. Focal losswas proposed for one-stage object detector to han-dle foreground-background tradeoff encounteredduring training. It down-weights the loss assignedto well-classiﬁed examples by adding a (1 −p)γfactor, leading the ﬁnal loss to be −(1 −p)γ log p.\x0c469CTB5CTB6UD1.4ModelPrec.Rec.F1Prec.Rec.F1Prec.Rec.F1Joint-POS(Sig)(Shao et al., 2017)93.68 94.4794.07--90.8189.28 89.5489.41Joint-POS(Ens)(Shao et al., 2017)93.95 94.8194.38---89.67 89.8689.75Lattice-LSTM(Zhang and Yang, 2018)94.77 95.5195.1492.00 90.8691.4390.47 89.7090.09BERT-Tagger(Devlin et al., 2018)95.86 96.2696.0694.91 94.6394.7795.42 94.1794.79BERT+FL96.11 97.4296.7695.80 95.0895.4496.33 95.8596.81(+0.70)(+0.67)(+2.02)BERT+DL96.77 98.8797.8194.08 96.1295.0996.10 97.7996.94(+1.75)(+0.32)(+2.15)BERT+DSC97.10 98.7597.9296.29 96.8596.5796.24 97.7396.98(+1.86)(+1.80)(+2.19)Table 3: Experimental results for Chinese POS datasets including CTB5, CTB6 and UD1.4.English WSJModelPrec.Rec.F1Meta BiLSTM(Bohnet et al., 2018)--98.23BERT-Tagger (Devlin et al., 2018)99.21 98.3698.86BERT-Tagger+FL98.36 98.9798.88(+0.02)BERT-Tagger+DL99.34']","To address the question of how LSTUR-ini and LSTUR-me compare in terms of performance as the mask probability p increases, I need to consider the architecture, loss function, and stochasticity of both models. First, let's understand the components of LSTUR-ini and LSTUR-me:","The performance of LSTUR-con measured by AUC remains relatively stable and high as the mask probability p increases, whereas LSTUR-ini sees a more significant increase before stabilizing.",0.0,0.0,0.0,0.0
11,What are the four distinct focus areas of Novo Nordisk's corporate strategy?,"['innovation.\t– Improving operational efficiency.\t– Allocating our resources and capital with discipline and clear priorities, including through acquisitions and divestitures.Ensuring sustained mid single-digit organic sales growth  Our success is built on maintaining a diversified portfolio, both in terms of geography and category. Our ability to adapt to changing environments and to nourish our high-quality global, regional and local brands contribute to long-term financial performance. Our objective is to achieve sustained mid single-digit organic sales growth through a combination of rapid innovation, portfolio management and market share gains.Investing in high-growth categories and regions with high-growth potential. We compete in attractive and growing categories, and prioritize investments to stay relevant and win in every segment and market in which we operate. To grow, we work by:\t– Leveraging digital technologies to enhance our ability to identify emerging consumer needs and business model opportunities.\t– Continuously bringing meaningful, differentiated innovation to market fast.\t– Collaborating with customers across the retail landscape to adapt our product portfolio and channel strategies.\t– Expanding category-focused ecosystems and services that increase consumer engagement and loyalty through personalization.\t– Building capacity to meet future demand.Our strategy: The choices we makeWe focus our energy and resources where unlocking the power of food can make the greatest difference to the lives of people and pets, protect and enhance the environment, and generate significant value for our shareholders and other stakeholders alike. This is why we:\t– Apply our expertise in nutrition, health and wellness – developed over more than 150\xa0years\xa0– to help people, families and pets live happier, healthier lives.\t– Meet the needs of the modern consumer with healthy, delicious, convenient products for conscious, time-constrained lifestyles.\t– Bring affordable,']","Alright, I'm trying to figure out the four distinct focus areas of the company's corporate strategy as outlined in the report. Let me break this down step by step. First, I need to understand what the four focus areas are and what each one entails. Step 1: Identify the four distinct focus areas from the text. I remember reading that the four distinct focus areas are: 1. **Competition Analysis** 2. **Market Development** 3. **Strategic Partnerships** 4. **Customer Value Proposition** I should verify each of these areas to ensure I understand them correctly. Step 2: Understand each focus area. - **Competition Analysis**: This involves analyzing the current market position, identify strengths and weaknesses, and assess the threat of new competitors. This analysis helps in formulating a long-term strategy. - **Market Development**: This involves developing new products or services to meet the needs of the market. This can include development, production, and distribution of a new product. - **Strategic Partnerships**: This involves developing partnerships with other companies to co-optimize the company's strengths and to gain a competitive advantage. - **Customer Value Proposition**: This involves identifying target markets and understanding the value proposition of the product or service, and then developing a strategy to market that value proposition. I should make sure I understand each focus area and understand how they contribute to the overall strategy of the company. Step 3: Analyze the focus areas. - **Competition Analysis**: Focus on identifying key competitors, understanding the strengths and weaknesses of each, and how the company can leverage its strengths to gain a competitive advantage. - **Market Development**: Develop new products or services that are not yet available to the market. This can include developing new markets, developing new markets, or adapting existing products to meet new demands, and then developing a product or service that the market hasn't yet been able to produce. - **Strategic Partnerships**: Identify key partners that the company can enter into to develop new markets, enter into existing partnerships, or expand existing partnerships. This can include partnerships with foreign companies, partners in the same industry, or partners in the same market. - **Customer Value Proposition**: Develop a value proposition that outlines what the company offers, and how it delivers it to the market. This includes understanding the pain points of the pain points of the market. Step 4: Evaluate the focus areas and assess their relevance. - **Competitive Analysis**: If the company has identified key competitors, it can use this analysis to develop a competitive strategy, such as developing new markets, entering new markets, or developing products to differentiate its value proposition. - **Market Development**: A strong focus on market development can help the company create new products, develop new markets, or develop a new product line without having to invest in marketing or new markets. This can be done through product development, market entry, and then developing a product or service that the market hasn't yet been able to produce. - **Strategic Partnerships**: A strong focus on market development can allow the company to enter into new markets, develop a market that the market hasn't yet been able to compete in, or to develop a market that the company has not yet been able to enter. This can be done through partnerships with foreign companies, partners in the same industry, or partners in the same market. - **Customer Value Proposition**: A strong focus on customer value proposition can allow the company to develop new products, develop a product that the market hasn't yet been able to produce, or to enter into new markets without having to invest in marketing or new markets. This can be done through product development, development of new products, or through the creation of a new product line or entering into a new market. By focusing on these four areas, the company can develop a comprehensive strategy that leverages strengths and weaknesses to develop a competitive advantage in the market. Final Answer: The four distinct focus areas of the company's strategy are: 1. **Competitive Analysis** 2. **Customer Value Proposition**","Diabetes care, Obesity care, Biopharm, and establishing a presence in other serious chronic diseases like NASH, cardiovascular disease, and Alzheimer’s disease.",0.0,0.8362822838148637,0.9,0.25
