,user_input,retrieved_contexts,response,reference,context_precision,answer_relevancy,faithfulness,context_recall
0,What is the significance of the R-GCN component within the Entity-GCN model based on the ablation study?,"['as important on model output (Ar-ras et al., 2017; Montavon et al., 2017; Serrano andSmith, 2019; Samek et al., 2016; Jain and Wallace,2019). We build upon these methods in Section4. Finally, we note that a recent article urges thecommunity to evaluate faithfulness on a continuousscale of acceptability, rather than viewing this as abinary proposition (Jacovi and Goldberg, 2020).3Datasets in ERASERFor all datasets in ERASER we distribute both ref-erence labels and rationales marked by humansas supporting these in a standardized format. We\x0c4446delineate train, validation, and test splits for allcorpora (see Appendix A for processing details).We ensure that these splits comprise disjoint setsof source documents to avoid contamination.3 Wehave made the decision to distribute the test setspublicly,4 in part because we do not view the ‘cor-rect’ metrics to use as settled. We plan to acquireadditional human annotations on held-out portionsof some of the included corpora so as to offer hid-den test set evaluation opportunities in the future.Evidence inference (Lehman et al., 2019).Adataset of full-text articles describing randomizedcontrolled trials (RCTs).The task is to inferwhether a given intervention is reported to eithersigniﬁcantly increase, signiﬁcantly decrease, orhave no signiﬁcant effect on a speciﬁed outcome, ascompared to a comparator of interest. Rationaleshave been marked as supporting these inferences.As the original annotations are not necessarily ex-haustive, we collected exhaustive rationale annota-tions on a subset of the validation and test data.5BoolQ (Clark et al., 2019). This corpus consistsof passages selected from Wikipedia, and yes/noquestions generated from these passages. As theoriginal Wikipedia article versions used were notmaintained, we have made a best-effort attempt torecover these, and then ﬁnd within them the pas-sages answering the corresponding questions. Forpublic release, we acquired comprehensive annota-tions on a subset of']","Okay, so I'm trying to understand the R-GCN model's significance in the context of graph neural networks. Let me break this down step by step. First, I know that graph neural networks are a type of neural network designed specifically for data that can be represented as a graph. This is useful in many real-world applications like social networks, recommendation systems, and fraud detection. Now, the term ""R-GCN"" stands for ""Reinforcement Graph Neural Network."" From what I remember, traditional graph neural networks operate by processing each node individually, often learning representations that allow for tasks like node classification or link prediction. However, R-GCN takes a different approach by incorporating reinforcement learning into the graph learning process. I remember reading that R-GCN uses a reinforcement framework where the model learns to update its representations in a way that maximizes a specific reward function. This is interesting because it means the graph structure itself can influence the learning process. In the context of a graph, the reward function could be something like predicting the accuracy of a node or the accuracy of a link. I remember that in the original paper, the authors introduced a specific architecture for R-GCN. It involves a graph convolutional layer followed by a graph pooling operation, then a fully connected layer, and then an output layer. The pooling operation is crucial because it aggregates information from the graph nodes to create a compact representation that can be used for tasks like node classification. I'm a bit fuzzy on the exact steps involved. Let me try to outline it: 1. **Graph Convolutional Layer:** This layer extracts local patterns or features from the graph structure. In the context of a graph, this might involve identifying important nodes or hubs. 2. **Graph Pooling Operation:** This step reduces the complexity of the graph by aggregating features from connected nodes into a compact representation. This compact representation is used for the final classification task. 3. **Fully Connected Network:** The compact representation from the pooling operation is then fed into a fully connected layer to produce the final output. I'm not entirely sure about the exact steps and terminology used in R-GCN. I think the graph pooling operation might be similar to pooling operations in traditional CNNs, but in the context of graphs, pooling might be more complex due to the graph structure. One of the key benefits of R-GCN is that it can learn robust graph representations that perform well on different graph structures. This is important because graph structures can vary, and the model should be able to adapt to different types of graphs. Another benefit is that R-GCN can leverage domain-specific knowledge by incorporating domain-specific features into the training process. This can improve performance on tasks like social network analysis, fraud detection, and recommendation systems. I'm curious about how the reinforcement aspect works in this context. In traditional reinforcement learning, an agent learns to make decisions by interacting with an environment. In R-GCN, the environment is the graph itself, and the agent learns the optimal way to traverse or interact with the graph. This learning process allows the R-GCN to find the most efficient or optimal path in a graph, which can be useful for tasks like route optimization or traffic management. I'm also wondering about the applications of R-GCN. Beyond social networks, R-GCN has potential applications in fields like chemistry, materials science, and drug discovery. In these areas, the graph structure represents relationships between entities, and the graph can be used to model interactions and properties. This makes R-GCN a versatile tool for modeling complex systems. I'm trying to think about how the R-GCN model operates step by step. Let's say we have a social network graph where nodes represent people and edges represent relationships. The R-GCN would first apply a graph convolutional layer to extract local features, then apply a pooling operation to aggregate these features into a compact representation. Finally, the compact representation would be used to classify nodes or predict relationships. I'm not entirely sure about the specifics of how the pooling operation works in this context. Is it based on the graph structure, or does it depend on the application? I think it's based on the relationships between nodes, which might involve specific features that the R-GCN can leverage. One of the main advantages of R-GCN is its ability to adapt to different graph structures. This ability makes R-GCN versatile and applicable across various applications. However, I'm also aware that the R-GCN has some limitations. For example, the graph convolutional layer might not capture all the necessary information depending on the task, and the learning process could be computationally intensive for large graphs. Another advantage of R-GCN is that it can learn hierarchical representations of the graph. This hierarchical representation might allow for better generalization and interpretability of the results. This hierarchical structure might make it easier to understand which parts of the graph are important for a particular classification task. I'm also curious about how R-GCN compares to other graph neural network architectures. For example, how does R-GCN compare to other graph convolutional architectures like GCN or GAT? Are there specific advantages or disadvantages of using R-GCN over other types of graph convolutions? I think the advantages of R-GCN over other graph convolutional architectures are numerous. The reinforcement aspect of R-GCN allows the model to learn not just which nodes to aggregate, but also which edges to prioritize. This adaptability can be a significant advantage in real-world applications where the graph structure might be incomplete or noisy. In the context of the ablation study mentioned in the original paper, the study likely investigates how different aspects of the R-GCN architecture affect its performance. This could include things like the number of layers in the model, the depth of the network, or the amount of data used for training. Such an analysis would be valuable because it provides concrete evidence of the model's strengths and weaknesses. One potential limitation of R-GCN is that it might struggle with graphs with a large number of nodes or edges. The computational resources required to process such graphs could be prohibitive. Additionally, the graph structure might not always be available in a user's dataset, making it difficult to adapt the model to new data. I'm also thinking about real-world applications of R-GCN. For example, R-GCN could be used to recommend products in e-commerce by analyzing which products are frequently purchased together. The graph structure could represent products and their co-occurrence in transactions. By learning a compact representation of the graph, R-GCN could learn a feature space where certain nodes are more similar to others, making it easier to cluster or segment the graph. Another potential application is in fraud detection. If R-GCN is trained on a graph that represents fraud patterns, it might be able to learn features that could be used to flag anomalies in the graph structure. In summary, R-GCN is a graph neural network that learns to represent graph structures in a way that is useful for downstream tasks. The R-GCN architecture includes a graph convolutional layer followed by a pooling operation and a fully connected layer, and it can be applied to various real-world problems. However, there are potential limitations, such as the need for large amounts of data and complex computational resources, and real-world applications may require addressing these challenges. One final point: the term ""Reinforcement Graph Neural Network"" suggests that R-GCN operates by learning to perform certain tasks through interaction with the graph. This is similar to how reinforcement learning works, where the agent interacts with the environment (in this case, the graph) to learn optimal strategies. In R-GCN, the agent learns to traverse the graph in a way that maximizes a reward function, which could be a specific reward function tailored to the task. I think I've covered the key points of R-GCN, including its structure, learning process, and potential applications. If there are specific issues or limitations mentioned in the original paper, those would be worth looking into for practical applications. For example, the authors might suggest ways to improve the performance of R-GCN on specific tasks or identify areas where it can be applied. In conclusion, R-GCN is a versatile and powerful graph neural network that can be applied to a wide range of real-world tasks by leveraging the graph structure to extract meaningful information and perform complex computations. By incorporating elements like reinforcement learning, R-GCN can perform tasks such as route prediction, fraud detection, and fraud prediction. However, there are potential challenges such as computational complexity and node representation in the graph that need to be addressed for practical applications.",The R-GCN component is significant as it enhances the model's ability to perform above Coref-GRU without accessing context by updating mention representations based on the relation to other ones. This is demonstrated by an 8.0 point loss in accuracy when the R-GCN component is removed.,0.0,0.8755084148419426,0.6111111111111112,1.0
1,What are the consequences for a foreign national who changes their resident status and moves out of Iran without transferring their real estate rights?,"['or a non-Muslim otherwise protected within the borders of Iran, this person is to be sentenced to death.32 If a Muslim, a member of a recognized religious minority, or a person protected within the borders of Iran commits a crime against a non-Muslim who is not one of these specified groups, this crime would be reclassified under Book V of the penal code, and the perpetrator would be subject to a lighter punishment.  9.  Usurious Transactions  Usury is forbidden in Islam.33 The penal code provides for discriminatory behavior against non-Muslims in a provision that exempts Muslims from certain penalties when they are involved in usurious transactions with non-Muslims but does not offer a reciprocal exemption for non-Muslims receiving usury from Muslims.34 Additionally, the code fails to safeguard the property rights of non-Muslims in cases where the owner is unknown, leading to the transfer of the non-Muslim’s property to the supreme leader without considering the owner’s religion.35  III.  Personal Status and Relations Regulations  According to article 13 of the constitution, the personal relations and status of constitutionally recognized religious minorities in Iran must be governed according to the accepted and common principles of their respective religions. This includes various family matters, including child adoption. The application of rules accepted by religious minorities is allowed in legal proceedings and daily practices as long as a specific case does not cause “public disorder.” This principle is further developed by articles 6 and 7 of the civil code, which provide for regulating the personal relations and status of foreign nationals residing in Iran under laws of their country of origin to the extent that is provided by bilateral treaties, international conventions, and rules of reciprocity.36  Article 13 of the constitution is supported by statutory and regulatory acts addressing the personal relations and status of individuals of each of the']","Alright, so I'm trying to figure out what happens when a foreign national moves out of Iran without transferring their real estate rights. Let me break this down step by step. First, I need to understand the law regarding real estate transfers in Iran. I know that in many countries, moving a person's real estate rights can be tricky, but there are specific laws that govern these transfers. First, the law of moving property rights in different countries can vary a lot. In some countries, like the United States, the government can enforce the law, while in others, like Iran, the government can be less proactive. In Iran, the government is more proactive, especially in moving property rights. So, if a person moves their real estate rights, they might face legal consequences in Iran. I remember that in Iran, the law of moving property rights is based on the law, not the government. This means that the government can’t transfer the property rights of a person without the explicit consent of the government. So, if a person wants to move their real estate rights, they have to go directly to the court to do so, and the court will decide the matter. The legal consequences of moving property rights can vary depending on the country and the type of property. In some countries, moving property rights can lead to the destruction of property, while in others, it can lead to the destruction of public infrastructure. In Iran, moving property rights can lead to the destruction of property, but the nature of the property can vary. Another thing to consider is the process of moving property rights. In some countries, moving property rights requires the government to issue a certificate or license that allows the person to transfer their real estate rights. In Iran, moving property rights requires the court to issue a certificate that allows the person to transfer their real estate rights. If a person wants to move their real estate rights, they have to go through the legal process in their country. This process is more proactive than in other countries, which can make the process more complex and time-consuming. In Iran, moving property rights is a serious matter, and the process is carefully considered to protect the rights of the real estate owner. I also need to think about the consequences of moving property rights. If a person moves their real estate rights, they can’t sell their property rights anymore, and their real estate rights are null and void. This means that the person can’t transfer their real estate rights to others. The government can’t enforce the law, and the person can’t move their real estate rights without transferring their real estate rights. In some countries, moving property rights can lead to the destruction of property, but in others, it can lead to the destruction of public infrastructure. In Iran, moving property rights can lead to the destruction of property, but it can also be used to build new infrastructure. The nature of the property and the rights of the property owner can vary. I should also consider the potential consequences of moving property rights in terms of legal and ethical implications. Moving property rights can lead to legal consequences in terms of the destruction of property, which can lead to the destruction of property in other countries. It can also lead to the destruction of property in other places, which can lead to the destruction of property in other countries. In some countries, moving property rights can lead to the destruction of property, but in some countries, moving property rights can lead to the destruction of property. Moving property rights can also be used to build new infrastructure, which can lead to the destruction of property in other countries. In terms of the consequences of moving property rights, the consequences can vary depending on the country and the type of property. In some countries, moving property rights leads to the destruction of property, and moving property rights can lead to the destruction of property. In other countries, moving property rights leads to the destruction of property. In some countries, moving property rights can lead to the destruction of property, but the nature of the property rights can vary. In some countries, moving property rights leads to the destruction of property, but moving property rights can also be used to build new infrastructure, which can lead to the destruction of property in other countries. In some countries, moving property rights leads to the destruction of property, while in other countries, moving property rights leads to the destruction of property. In some countries, moving property rights leads to the destruction of property, while the type of property being moved is also a factor. The type of property being moved can vary. Moving property rights can lead to the destruction of property, while the type of property being moved is also a factor. In some countries, moving property rights leads to the destruction of","If a foreign national changes their resident status and relocates outside Iran without transferring their real estate rights to an Iranian citizen within six months, the government will conduct an auction of the real estate and provide the sale proceeds to the foreign national or their heirs after expenses.",0.0,0.8657319095675793,0.47368421052631576,1.0
